{
  "$schema": "../schemas/external-validation-ledger.schema.json",
  "schema_version": "1.0.0",
  "campaign": {
    "id": "veritas-trust-lab-50-or-payment",
    "subject": "VERITAS Omega Agent Trust Lab",
    "validation_target": 50,
    "payment_threshold": "greater_than_0_usd",
    "started_at": "2026-07-29T09:33:26Z"
  },
  "summary": {
    "qualifying_events": 6,
    "distinct_validators": 6,
    "verified_payment_usd": "0.00",
    "remaining_to_validation_target": 44,
    "terminal_state": "ACTIVE"
  },
  "counting_policy": {
    "qualifying_categories": [
      "accepted_external_integration",
      "catalog_curator_acceptance",
      "editorial_coverage",
      "external_adopter_report",
      "independent_blind_label_set",
      "independent_technical_reproduction",
      "substantive_external_review"
    ],
    "never_count": [
      "author_activity",
      "bot_or_ci",
      "duplicate_signal",
      "open_pr",
      "outreach_sent",
      "self_test",
      "thanks_only",
      "traffic"
    ],
    "independence_rule": "The counted action must be attributable to a person or organization outside VrtxOmega and its AI agents, with a public or independently verifiable source.",
    "dedupe_rule": "Count one independently attributable action per actor, category, and subject. Repeated comments, reruns, mirrors, and duplicate submissions remain one event.",
    "scope_rule": "Every event states only what the observed action validates and lists the adoption, correctness, endorsement, payment, or certification claims it does not establish."
  },
  "events": [
    {
      "id": "VTL-EXT-20260729-001",
      "status": "qualifying",
      "category": "catalog_curator_acceptance",
      "subject_id": "systempromptio/awesome-ai-agent-governance#27",
      "actor": {
        "id": "github:Ejb503",
        "platform": "github",
        "account": "Ejb503",
        "type": "github_account",
        "relationship": "independent",
        "is_bot": false,
        "independence_basis": "The actor had merge authority in an external repository not controlled by VrtxOmega."
      },
      "action": "merged_curated_listing",
      "validation_claim": "An external curator accepted the Trust Lab as relevant to the repository's AI-agent governance catalogue.",
      "scope": "This validates scoped catalogue fit and discoverability inside that external repository at the recorded commit.",
      "does_not_establish": [
        "product adoption",
        "technical correctness",
        "security assurance",
        "endorsement of VERITAS",
        "payment"
      ],
      "source_url": "https://github.com/systempromptio/awesome-ai-agent-governance/pull/27",
      "occurred_at": "2026-07-29T09:33:26Z",
      "verification": {
        "status": "verified",
        "method": "GitHub pull-request API and live main-branch readback",
        "verified_at": "2026-07-29T12:48:00Z",
        "immutable_ref_type": "git_commit",
        "immutable_ref": "2a2fd6d84c1b57b89faf8e786615c8f6d7a3ed69"
      },
      "dedupe_key": "github:Ejb503|catalog_curator_acceptance|systempromptio/awesome-ai-agent-governance#27",
      "count_weight": 1
    },
    {
      "id": "VTL-EXT-20260729-002",
      "status": "qualifying",
      "category": "catalog_curator_acceptance",
      "subject_id": "gmh5225/awesome-ai-security#18",
      "actor": {
        "id": "github:gmh5225",
        "platform": "github",
        "account": "gmh5225",
        "type": "github_account",
        "relationship": "independent",
        "is_bot": false,
        "independence_basis": "The actor owns and had merge authority in an external repository not controlled by VrtxOmega."
      },
      "action": "merged_curated_listing",
      "validation_claim": "An external repository owner accepted the Trust Lab as relevant to the repository's AI-security catalogue.",
      "scope": "This validates scoped catalogue fit and discoverability inside that external repository at the recorded commit.",
      "does_not_establish": [
        "product adoption",
        "technical correctness",
        "security assurance",
        "endorsement of VERITAS",
        "payment"
      ],
      "source_url": "https://github.com/gmh5225/awesome-ai-security/pull/18",
      "occurred_at": "2026-07-29T11:43:46Z",
      "verification": {
        "status": "verified",
        "method": "GitHub pull-request API and live main-branch readback",
        "verified_at": "2026-07-29T12:48:00Z",
        "immutable_ref_type": "git_commit",
        "immutable_ref": "0a48d9a8e20cdcb92f0796d7df45e0a55ef3200c"
      },
      "dedupe_key": "github:gmh5225|catalog_curator_acceptance|gmh5225/awesome-ai-security#18",
      "count_weight": 1
    },
    {
      "id": "VTL-EXT-20260729-003",
      "status": "qualifying",
      "category": "independent_technical_reproduction",
      "subject_id": "pranee54/AgentDoctor#18",
      "actor": {
        "id": "github:pranee54",
        "platform": "github",
        "account": "pranee54",
        "type": "github_account",
        "relationship": "independent",
        "is_bot": false,
        "independence_basis": "The actor owns the external AgentDoctor repository and submitted the blocking review from an account outside VrtxOmega."
      },
      "action": "reproduced_output_file_symlink_escape_and_requested_changes",
      "validation_claim": "The external repository owner independently reproduced an outside-workspace write through an existing output-file symlink and issued a blocking technical review.",
      "scope": "This validates one concrete external reproduction and actionable review of the campaign-produced Action contribution.",
      "does_not_establish": [
        "acceptance of the proposed fix",
        "pull-request merge",
        "product adoption",
        "overall security assurance",
        "technical correctness of VERITAS",
        "endorsement of VERITAS",
        "payment"
      ],
      "source_url": "https://github.com/pranee54/AgentDoctor/pull/18#pullrequestreview-4811661364",
      "occurred_at": "2026-07-29T18:26:32Z",
      "verification": {
        "status": "verified",
        "method": "GitHub pull-request review API and live PR readback",
        "verified_at": "2026-07-29T18:42:33Z",
        "immutable_ref_type": "issue_comment_id",
        "immutable_ref": "PRR_kwDOTmlLDc8AAAABHswgNA"
      },
      "dedupe_key": "github:pranee54|independent_technical_reproduction|pranee54/AgentDoctor#18",
      "count_weight": 1
    },
    {
      "id": "VTL-EXT-20260729-004",
      "status": "qualifying",
      "category": "accepted_external_integration",
      "subject_id": "mick-gsk/drift#792",
      "actor": {
        "id": "github:mick-gsk",
        "platform": "github",
        "account": "mick-gsk",
        "type": "github_account",
        "relationship": "independent",
        "is_bot": false,
        "independence_basis": "The actor owns the external Drift repository and merged the contribution from an account outside VrtxOmega."
      },
      "action": "merged_external_contribution",
      "validation_claim": "The external repository owner accepted and merged the campaign-produced staleness sampling fix into Drift.",
      "scope": "This validates the scoped contribution's acceptance and integration into the external repository at the recorded merge commit.",
      "does_not_establish": [
        "independent product adoption of VERITAS",
        "technical correctness of VERITAS",
        "overall security assurance",
        "endorsement of VERITAS",
        "payment"
      ],
      "source_url": "https://github.com/mick-gsk/drift/pull/792",
      "occurred_at": "2026-07-29T23:46:58Z",
      "verification": {
        "status": "verified",
        "method": "GitHub pull-request API and live merged-PR readback",
        "verified_at": "2026-07-29T23:50:39Z",
        "immutable_ref_type": "git_commit",
        "immutable_ref": "9f0fc026738de2602bf972863d244a94970e9296"
      },
      "dedupe_key": "github:mick-gsk|accepted_external_integration|mick-gsk/drift#792",
      "count_weight": 1
    },
    {
      "id": "VTL-EXT-20260730-005",
      "status": "qualifying",
      "category": "accepted_external_integration",
      "subject_id": "trailofbits/dylint#2016",
      "actor": {
        "id": "github:smoelius",
        "platform": "github",
        "account": "smoelius",
        "type": "github_account",
        "relationship": "independent",
        "is_bot": false,
        "independence_basis": "The actor is a collaborator in the external Dylint repository and merged the pull request from an account outside VrtxOmega."
      },
      "action": "reviewed_corrected_and_merged_misleading_variable_name_fix",
      "validation_claim": "An external Dylint collaborator materially reviewed the campaign-produced lint contribution, required synchronized rustdoc and generated README corrections, and then merged the corrected pull request.",
      "scope": "This validates one accepted external integration after substantive maintainer review on the recorded Dylint pull request. The review and merge are one event because the same actor acted on the same subject.",
      "does_not_establish": [
        "release inclusion",
        "deployed availability",
        "technical correctness of the contribution",
        "project-wide correctness",
        "product adoption",
        "technical correctness of VERITAS",
        "security assurance",
        "endorsement of VERITAS",
        "certification",
        "payment"
      ],
      "source_url": "https://github.com/trailofbits/dylint/pull/2016",
      "occurred_at": "2026-07-30T04:24:18Z",
      "verification": {
        "status": "verified",
        "method": "GitHub pull-request API, merge-actor readback, and immutable merge-commit verification",
        "verified_at": "2026-07-30T04:31:56Z",
        "immutable_ref_type": "git_commit",
        "immutable_ref": "41e2a17009a5cb329e9ab3e314a33fffeba5d67c"